{
  "$schema": "https://json-schema.org/draft/2020-12/schema",
  "$id": "https://forge-contracts.amerzel.dev/ability_catalog.v1.schema.json",
  "title": "ability_catalog.v1",
  "description": "A collection of combat abilities for the party combat pipeline. Each entry defines targeting, cost, and effect data consumed by the Godot import pipeline.",
  "type": "object",
  "additionalProperties": false,
  "required": [
    "schema",
    "abilities"
  ],
  "properties": {
    "schema": {
      "const": "ability_catalog.v1"
    },
    "producer": {
      "type": "object",
      "description": "Identifies the tool that generated this document (VOCABULARY.md §1).",
      "additionalProperties": false,
      "required": [
        "tool",
        "version",
        "generatedAt"
      ],
      "properties": {
        "tool": {
          "type": "string",
          "minLength": 1
        },
        "version": {
          "type": "string",
          "minLength": 1
        },
        "generatedAt": {
          "type": "string",
          "description": "ISO 8601 timestamp of generation."
        }
      }
    },
    "abilities": {
      "type": "array",
      "minItems": 1,
      "items": {
        "$ref": "#/$defs/ability"
      }
    },
    "meta": {
      "type": "object",
      "additionalProperties": false,
      "properties": {
        "description": {
          "type": "string"
        },
        "extensions": {
          "type": "object",
          "description": "Tool-specific extension metadata. Keyed by tool name. Consumers MUST ignore unknown keys.",
          "additionalProperties": true
        }
      }
    }
  },
  "$defs": {
    "ability": {
      "type": "object",
      "additionalProperties": true,
      "required": [
        "id",
        "name",
        "type",
        "cost_focus",
        "target_mode",
        "damage_type",
        "base_power",
        "cooldown_turns",
        "description"
      ],
      "properties": {
        "id": {
          "type": "string",
          "minLength": 1
        },
        "name": {
          "type": "string",
          "minLength": 1
        },
        "type": {
          "type": "string",
          "enum": [
            "attack",
            "heal",
            "buff",
            "debuff"
          ]
        },
        "cost_focus": {
          "type": "integer",
          "minimum": 0
        },
        "target_mode": {
          "type": "string",
          "enum": [
            "single_enemy",
            "all_enemies",
            "single_ally",
            "all_allies",
            "self"
          ]
        },
        "damage_type": {
          "type": "string",
          "enum": [
            "physical",
            "magical",
            "true",
            "heal"
          ]
        },
        "base_power": {
          "type": "integer",
          "minimum": 0
        },
        "cooldown_turns": {
          "type": "integer",
          "minimum": 0
        },
        "applies_status_ref": {
          "type": "string"
        },
        "description": {
          "type": "string",
          "minLength": 1
        }
      }
    }
  }
}
